[
  {
    "id": "6th-street-recruits",
    "name": "6th Street Recruits",
    "subtitle": null,
    "type": "unit",
    "color": "red",
    "ram": 1,
    "cost": 4,
    "power": 6,
    "streetCred": null,
    "tags": [
      "6TH STREET",
      "GANGER"
    ],
    "keywords": [],
    "text": "When a friendly Unit steals a d6, increase a Gig by up to 6.",
    "abilities": [
      "When a friendly Unit steals a d6, increase a Gig by up to 6."
    ],
    "imageUrl": "backend/src/main/resources/static/images/cards/6th-street-recruits.png",
    "setCode": "WELCOMETONIGHTCITYRETAIL",
    "collectorNumber": "006",
    "rarity": "common"
  },
  {
    "id": "adam-smasher-ender-of-legends",
    "name": "Adam Smasher",
    "subtitle": "Ender of Legends",
    "type": "legend",
    "color": "red",
    "ram": 2,
    "cost": 9,
    "power": 9,
    "streetCred": null,
    "tags": [
      "ARASAKA",
      "MERC"
    ],
    "keywords": [
      "go_solo",
      "play",
      "attack"
    ],
    "text": "{Go Solo} (Pay this Legend's cost to play it as a ready Unit. It can attack this turn. If it leaves the field, remove it from the game.) {Play} Defeat a rival Unit.",
    "abilities": [
      "{Go Solo} (Pay this Legend's cost to play it as a ready Unit. It can attack this turn. If it leaves the field, remove it from the game.)",
      "{Play} Defeat a rival Unit."
    ],
    "imageUrl": "/images/cards/adam-smasher-ender-of-legends.png",
    "setCode": "WELCOMETONIGHTCITYRETAIL",
    "collectorNumber": "001",
    "rarity": "epic"
  },
  {
    "id": "adam-smasher-metal-over-meat",
    "name": "Adam Smasher",
    "subtitle": "Metal Over Meat",
    "type": "unit",
    "color": "yellow",
    "ram": 6,
    "cost": 9,
    "power": 15,
    "streetCred": null,
    "tags": [
      "ARASAKA",
      "MERC"
    ],
    "keywords": [
      "play"
    ],
    "text": "{Play} Defeat all other Units.",
    "abilities": [
      "{Play} Defeat all other Units."
    ],
    "imageUrl": "/images/cards/adam-smasher-metal-over-meat.png",
    "setCode": "WELCOMETONIGHTCITYRETAIL",
    "collectorNumber": "041",
    "rarity": "epic"
  },
  {
    "id": "adrenaline-converter",
    "name": "Adrenaline Converter",
    "subtitle": null,
    "type": "gear",
    "color": "yellow",
    "ram": 4,
    "cost": 2,
    "power": 3,
    "streetCred": null,
    "tags": [
      "CYBERWARE",
      "MEDTECH"
    ],
    "keywords": [
      "attack"
    ],
    "text": "(Equip to a friendly Unit or face-up Legend.) If a Rival controls at least 2 more Gigs than you, this Unit has {Adrenaline}. (This Unit can attack the turn it's played.)",
    "abilities": [
      "(Equip to a friendly Unit or face-up Legend.)",
      "If a Rival controls at least 2 more Gigs than you, this Unit has {Adrenaline}. (This Unit can attack the turn it's played.)"
    ],
    "imageUrl": "/images/cards/adrenaline-converter.png",
    "setCode": "WELCOMETONIGHTCITYRETAIL",
    "collectorNumber": "059",
    "rarity": "common"
  },
  {
    "id": "afterparty-at-lizzie-s",
    "name": "Afterparty at Lizzie's",
    "subtitle": null,
    "type": "program",
    "color": "yellow",
    "ram": 1,
    "cost": 1,
    "power": null,
    "streetCred": null,
    "tags": [
      "BRAINDANCE",
      "MOX"
    ],
    "keywords": [],
    "text": "Adjust a Gig by up to 1. If you control 2 or more Gigs with different values, draw 1.",
    "abilities": [
      "Adjust a Gig by up to 1. If you control 2 or more Gigs with different values, draw 1."
    ],
    "imageUrl": "/images/cards/afterparty-at-lizzie-s.png",
    "setCode": "WELCOMETONIGHTCITYRETAIL",
    "collectorNumber": "065",
    "rarity": "common"
  },
  {
    "id": "all-is-lost",
    "name": "All is Lost",
    "subtitle": null,
    "type": "program",
    "color": "red",
    "ram": 2,
    "cost": 1,
    "power": null,
    "streetCred": null,
    "tags": [
      "ZETATECH"
    ],
    "keywords": [],
    "text": "Trash 3. Add a Unit from among them to your hand.",
    "abilities": [
      "Trash 3. Add a Unit from among them to your hand."
    ],
    "imageUrl": "/images/cards/all-is-lost.png",
    "setCode": "WELCOMETONIGHTCITYRETAIL",
    "collectorNumber": "027",
    "rarity": "common"
  },
  {
    "id": "alt-cunningham-mother-of-daemons",
    "name": "Alt Cunningham",
    "subtitle": "Mother of Daemons",
    "type": "unit",
    "color": "yellow",
    "ram": 3,
    "cost": 7,
    "power": 8,
    "streetCred": null,
    "tags": [
      "MERC",
      "NETRUNNER"
    ],
    "keywords": [],
    "text": "When a friendly equipped Unit or Legend is spent, draw 1. When a rival Unit would steal a Gig, you may discard 1 with cost equal to that Gig's value. If you do, the Gig isn't stolen.",
    "abilities": [
      "When a friendly equipped Unit or Legend is spent, draw 1.",
      "When a rival Unit would steal a Gig, you may discard 1 with cost equal to that Gig's value. If you do, the Gig isn't stolen."
    ],
    "imageUrl": "/images/cards/alt-cunningham-mother-of-daemons.png",
    "setCode": "WELCOMETONIGHTCITYRETAIL",
    "collectorNumber": "042",
    "rarity": "rare"
  },
  {
    "id": "alt-cunningham-soulkiller-architect",
    "name": "Alt Cunningham",
    "subtitle": "Soulkiller Architect",
    "type": "legend",
    "color": "blue",
    "ram": 2,
    "cost": null,
    "power": null,
    "streetCred": null,
    "tags": [
      "MERC",
      "NETRUNNER"
    ],
    "keywords": [
      "play"
    ],
    "text": "1 €$, {Spend} Play a Program from your trash. Bottom-deck it after you play it. (You still pay its cost.)",
    "abilities": [
      "1 €$, {Spend} Play a Program from your trash. Bottom-deck it after you play it. (You still pay its cost.)"
    ],
    "imageUrl": "/images/cards/alt-cunningham-soulkiller-architect.png",
    "setCode": "WELCOMETONIGHTCITYRETAIL",
    "collectorNumber": "106",
    "rarity": "rare"
  },
  {
    "id": "animals-wrecker",
    "name": "Animals Wrecker",
    "subtitle": null,
    "type": "unit",
    "color": "red",
    "ram": 3,
    "cost": 6,
    "power": 10,
    "streetCred": null,
    "tags": [
      "ANIMAL",
      "GANGER"
    ],
    "keywords": [],
    "text": "[Flavour Text] Takes a lot of juice to break bones like they do.",
    "abilities": [
      "[Flavour Text] Takes a lot of juice to break bones like they do."
    ],
    "imageUrl": "/images/cards/animals-wrecker.png",
    "setCode": "WELCOMETONIGHTCITYRETAIL",
    "collectorNumber": "007",
    "rarity": "common"
  },
  {
    "id": "appetite-for-destruction",
    "name": "Appetite for Destruction",
    "subtitle": null,
    "type": "program",
    "color": "red",
    "ram": 4,
    "cost": 3,
    "power": null,
    "streetCred": null,
    "tags": [
      "GANGER"
    ],
    "keywords": [],
    "text": "The next time a friendly Unit wins a fight by 3+ power this turn, it also steals a Gig.",
    "abilities": [
      "The next time a friendly Unit wins a fight by 3+ power this turn, it also steals a Gig."
    ],
    "imageUrl": "/images/cards/appetite-for-destruction.png",
    "setCode": "WELCOMETONIGHTCITYRETAIL",
    "collectorNumber": "028",
    "rarity": "uncommon"
  },
  {
    "id": "arasaka-emergency-radioport",
    "name": "Arasaka Emergency Radioport",
    "subtitle": null,
    "type": "gear",
    "color": "red",
    "ram": 2,
    "cost": 2,
    "power": 2,
    "streetCred": null,
    "tags": [
      "ARASAKA",
      "CYBERWARE"
    ],
    "keywords": [
      "go_solo"
    ],
    "text": "(Equip to a friendly Unit or face-up Legend.) When this Unit or Legend is spent, you may look at a friendly face-down Legend. If that Legend is ARASAKA or has {Go Solo}, you may Call it for free. (You may only Call a Legend once per turn.)",
    "abilities": [
      "(Equip to a friendly Unit or face-up Legend.)",
      "When this Unit or Legend is spent, you may look at a friendly face-down Legend. If that Legend is ARASAKA or has {Go Solo}, you may Call it for free. (You may only Call a Legend once per turn.)"
    ],
    "imageUrl": "/images/cards/arasaka-emergency-radioport.png",
    "setCode": "WELCOMETONIGHTCITYRETAIL",
    "collectorNumber": "023",
    "rarity": "common"
  },
  {
    "id": "augmented-negotiators",
    "name": "Augmented Negotiators",
    "subtitle": null,
    "type": "unit",
    "color": "yellow",
    "ram": 1,
    "cost": 3,
    "power": 2,
    "streetCred": null,
    "tags": [
      "ARASAKA",
      "CORPO"
    ],
    "keywords": [
      "blocker",
      "attack"
    ],
    "text": "{Blocker} (You may spend this Unit to redirect a rival Unit's attack to it instead.) When this Unit uses {Blocker}, a Rival discards 1.",
    "abilities": [
      "{Blocker} (You may spend this Unit to redirect a rival Unit's attack to it instead.)",
      "When this Unit uses {Blocker}, a Rival discards 1."
    ],
    "imageUrl": "/images/cards/augmented-negotiators.png",
    "setCode": "WELCOMETONIGHTCITYRETAIL",
    "collectorNumber": "043",
    "rarity": "common"
  },
  {
    "id": "bonnie-and-clyde",
    "name": "Bonnie and Clyde",
    "subtitle": null,
    "type": "program",
    "color": "red",
    "ram": 3,
    "cost": 3,
    "power": null,
    "streetCred": null,
    "tags": [
      "BRAINDANCE"
    ],
    "keywords": [],
    "text": "Defeat a rival Unit with power 4 or less. You may defeat 2 instead if a Rival controls at least 2 Gigs more than you.",
    "abilities": [
      "Defeat a rival Unit with power 4 or less. You may defeat 2 instead if a Rival controls at least 2 Gigs more than you."
    ],
    "imageUrl": "/images/cards/bonnie-and-clyde.png",
    "setCode": "WELCOMETONIGHTCITYRETAIL",
    "collectorNumber": "029",
    "rarity": "uncommon"
  },
  {
    "id": "bootleg-black-sapphire-show",
    "name": "Bootleg Black Sapphire Show",
    "subtitle": null,
    "type": "program",
    "color": "yellow",
    "ram": 4,
    "cost": 5,
    "power": null,
    "streetCred": null,
    "tags": [
      "BRAINDANCE"
    ],
    "keywords": [],